{
  "version": "1.0.0",
  "currency": "USD",
  "regions": [
    {
      "id": "na",
      "name": "North America",
      "freightTier": 1,
      "leadTimeAdderWeeks": 0
    },
    {
      "id": "eu",
      "name": "Europe",
      "freightTier": 1,
      "leadTimeAdderWeeks": 1
    },
    {
      "id": "latam",
      "name": "Latin America",
      "freightTier": 2,
      "leadTimeAdderWeeks": 2
    },
    {
      "id": "mena",
      "name": "Middle East / N. Africa",
      "freightTier": 2,
      "leadTimeAdderWeeks": 2
    },
    {
      "id": "ssa",
      "name": "Sub-Saharan Africa",
      "freightTier": 3,
      "leadTimeAdderWeeks": 3
    },
    {
      "id": "apac",
      "name": "Asia-Pacific",
      "freightTier": 2,
      "leadTimeAdderWeeks": 2
    },
    {
      "id": "polar",
      "name": "Polar / Antarctic",
      "freightTier": 3,
      "leadTimeAdderWeeks": 4
    }
  ],
  "modules": [
    {
      "id": "core",
      "name": "AXAL Core",
      "sku": "AX-CORE-01",
      "category": "Foundation",
      "basePrice": 84000,
      "currency": "USD",
      "dimensions": {
        "form": "10ft",
        "lengthFt": 10,
        "widthFt": 8,
        "heightFt": 8.5
      },
      "weight": {
        "kg": 2400,
        "displayTons": "2.4 t"
      },
      "power": {
        "drawKw": 1.2
      },
      "leadTimeWeeks": 4,
      "regions": [
        "na",
        "eu",
        "latam",
        "mena",
        "ssa",
        "apac",
        "polar"
      ],
      "interconnects": [
        {
          "targetModuleId": "volt",
          "type": "power",
          "required": true
        },
        {
          "targetModuleId": "volt",
          "type": "data"
        },
        {
          "targetModuleId": "flow",
          "type": "data"
        },
        {
          "targetModuleId": "grow",
          "type": "data"
        },
        {
          "targetModuleId": "shell",
          "type": "data"
        },
        {
          "targetModuleId": "cycle",
          "type": "data"
        },
        {
          "targetModuleId": "care",
          "type": "data"
        },
        {
          "targetModuleId": "learn",
          "type": "data"
        }
      ],
      "options": [
        {
          "id": "compute-base",
          "name": "16-core EPYC / 64 GB",
          "category": "Compute Tier",
          "default": true,
          "priceDelta": 0,
          "weightDelta": 0,
          "powerDelta": 0,
          "requires": [],
          "excludes": [
            "compute-hd"
          ]
        },
        {
          "id": "compute-hd",
          "name": "32-core EPYC / 256 GB + GPU",
          "category": "Compute Tier",
          "default": false,
          "priceDelta": 28000,
          "weightDelta": 0,
          "powerDelta": 1.8,
          "requires": [],
          "excludes": [
            "compute-base"
          ]
        },
        {
          "id": "storage-8tb",
          "name": "8 TB NVMe RAID-1",
          "category": "Storage Tier",
          "default": true,
          "priceDelta": 0,
          "weightDelta": 0,
          "powerDelta": 0,
          "requires": [],
          "excludes": [
            "storage-32tb",
            "storage-64tb"
          ]
        },
        {
          "id": "storage-32tb",
          "name": "32 TB NVMe RAID-10",
          "category": "Storage Tier",
          "default": false,
          "priceDelta": 6800,
          "weightDelta": 0,
          "powerDelta": 0,
          "requires": [],
          "excludes": [
            "storage-8tb",
            "storage-64tb"
          ]
        },
        {
          "id": "storage-64tb",
          "name": "64 TB NVMe + 200 TB cold",
          "category": "Storage Tier",
          "default": false,
          "priceDelta": 14200,
          "weightDelta": 0,
          "powerDelta": 0,
          "requires": [],
          "excludes": [
            "storage-8tb",
            "storage-32tb"
          ]
        },
        {
          "id": "net-1g",
          "name": "1 GbE WAN",
          "category": "Network",
          "default": true,
          "priceDelta": 0,
          "weightDelta": 0,
          "powerDelta": 0,
          "requires": [],
          "excludes": [
            "net-10g"
          ]
        },
        {
          "id": "net-10g",
          "name": "10 GbE + SFP+ uplink",
          "category": "Network",
          "default": false,
          "priceDelta": 4200,
          "weightDelta": 0,
          "powerDelta": 0,
          "requires": [],
          "excludes": [
            "net-1g"
          ]
        },
        {
          "id": "cooling-air",
          "name": "Front-to-back air cooling",
          "category": "Cooling",
          "default": true,
          "priceDelta": 0,
          "weightDelta": 0,
          "powerDelta": 0,
          "requires": [],
          "excludes": [
            "cooling-liquid"
          ]
        },
        {
          "id": "cooling-liquid",
          "name": "Direct-liquid cooling loop",
          "category": "Cooling",
          "default": false,
          "priceDelta": 9800,
          "weightDelta": 0,
          "powerDelta": -0.4,
          "requires": [
            "compute-hd"
          ],
          "excludes": [
            "cooling-air"
          ]
        },
        {
          "id": "power-input-dc",
          "name": "800 V DC bus only",
          "category": "Power Input",
          "default": true,
          "priceDelta": 0,
          "weightDelta": 0,
          "powerDelta": 0,
          "requires": [],
          "excludes": [
            "power-input-ac"
          ]
        },
        {
          "id": "power-input-ac",
          "name": "800 V DC + 3-phase AC tie",
          "category": "Power Input",
          "default": false,
          "priceDelta": 3200,
          "weightDelta": 0,
          "powerDelta": 0,
          "requires": [],
          "excludes": [
            "power-input-dc"
          ]
        },
        {
          "id": "climate-std",
          "name": "Standard climate (-20…+45 °C)",
          "category": "Climate Hardening",
          "default": true,
          "priceDelta": 0,
          "weightDelta": 0,
          "powerDelta": 0,
          "requires": [],
          "excludes": [
            "climate-arctic",
            "climate-desert"
          ]
        },
        {
          "id": "climate-arctic",
          "name": "Arctic pack (-55…+40 °C)",
          "category": "Climate Hardening",
          "default": false,
          "priceDelta": 7400,
          "weightDelta": 240,
          "powerDelta": 0,
          "requires": [],
          "excludes": [
            "climate-std",
            "climate-desert"
          ]
        },
        {
          "id": "climate-desert",
          "name": "Desert pack (+5…+60 °C)",
          "category": "Climate Hardening",
          "default": false,
          "priceDelta": 6200,
          "weightDelta": 180,
          "powerDelta": 0,
          "requires": [],
          "excludes": [
            "climate-std",
            "climate-arctic"
          ]
        },
        {
          "id": "sec-baseline",
          "name": "Baseline TPM + signed OS",
          "category": "Security",
          "default": true,
          "priceDelta": 0,
          "weightDelta": 0,
          "powerDelta": 0,
          "requires": [],
          "excludes": [
            "sec-classified"
          ]
        },
        {
          "id": "sec-classified",
          "name": "FIPS 140-3 + SCIF-ready",
          "category": "Security",
          "default": false,
          "priceDelta": 18500,
          "weightDelta": 0,
          "powerDelta": 0,
          "requires": [],
          "excludes": [
            "sec-baseline"
          ]
        },
        {
          "id": "ai-monitor",
          "name": "Local AI anomaly + vision",
          "category": "Monitoring & AI",
          "default": false,
          "priceDelta": 5400,
          "weightDelta": 0,
          "powerDelta": 0.6,
          "requires": [
            "compute-hd"
          ],
          "excludes": []
        },
        {
          "id": "uplink-starlink",
          "name": "Starlink + 5G + WAN trio",
          "category": "Connectivity",
          "default": true,
          "priceDelta": 0,
          "weightDelta": 0,
          "powerDelta": 0,
          "requires": [],
          "excludes": [
            "uplink-iridium"
          ]
        },
        {
          "id": "uplink-iridium",
          "name": "Iridium Certus + Starlink",
          "category": "Connectivity",
          "default": false,
          "priceDelta": 4600,
          "weightDelta": 0,
          "powerDelta": 0,
          "requires": [],
          "excludes": [
            "uplink-starlink"
          ]
        }
      ]
    },
    {
      "id": "volt",
      "name": "Volt",
      "sku": "AX-VOLT-01",
      "category": "Power",
      "basePrice": 62000,
      "currency": "USD",
      "dimensions": {
        "form": "20ft",
        "lengthFt": 20,
        "widthFt": 8,
        "heightFt": 8.5
      },
      "weight": {
        "kg": 8600,
        "displayTons": "8.6 t"
      },
      "power": {
        "drawKw": 0.4,
        "generationKw": 12,
        "storageKwh": 60
      },
      "leadTimeWeeks": 5,
      "regions": [
        "na",
        "eu",
        "latam",
        "mena",
        "ssa",
        "apac",
        "polar"
      ],
      "interconnects": [
        {
          "targetModuleId": "core",
          "type": "power",
          "required": true
        },
        {
          "targetModuleId": "flow",
          "type": "power"
        },
        {
          "targetModuleId": "grow",
          "type": "power"
        },
        {
          "targetModuleId": "shell",
          "type": "power"
        },
        {
          "targetModuleId": "cycle",
          "type": "power"
        },
        {
          "targetModuleId": "care",
          "type": "power"
        },